[
  {
    "sku": "ABC-101",
    "name": "Trail Bottle 750ml",
    "price_cents": 1800,
    "currency": "USD",
    "in_stock": true
  },
  {
    "sku": "ABC-102",
    "name": "Camp Mug",
    "price_cents": 1250,
    "currency": "USD",
    "in_stock": false
  },
  {
    "sku": "DEF-210",
    "name": "Headlamp 300lm",
    "price_cents": 3499,
    "currency": "USD",
    "in_stock": true
  },
  {
    "sku": "DEF-211",
    "name": "Spare Batteries (4)",
    "price_cents": 675,
    "currency": "USD",
    "in_stock": true
  },
  {
    "sku": "GHI-305",
    "name": "Rain Shell",
    "price_cents": 8900,
    "currency": "EUR",
    "in_stock": true
  },
  {
    "sku": "GHI-306",
    "name": "Packable Down Vest",
    "price_cents": 11900,
    "currency": "EUR",
    "in_stock": false
  }
]